id,questions,answers,round,asset
0,Can you provide an overview of the induced draft fan system and its components? This will help me understand the important components that need to be monitored and the potential failure modes that need to be detected.,"  Sure, I'd be happy to provide an overview of an induced draft fan system and its components.

An induced draft fan is a type of fan used in various industrial applications, such as power plants, chemical plants, and oil refineries. Its main function is to provide a continuous flow of air or gas through a system, creating a negative pressure that helps to draw the fluid through the system.

The main components of an induced draft fan system are:

1. Fan: This is the heart of the system, responsible for creating the airflow. The fan consists of a rotor and a stator, and it is typically driven by an electric motor.
2. Motor: The motor drives the fan, converting electrical energy into mechanical energy. The motor is usually a squirrel-cage induction motor or a synchronous motor.
3. Inlet guide vanes: These are passive devices that help to direct the airflow into the fan, ensuring that it enters the fan in a consistent and efficient manner.
4. Diffuser: This component is located downstream of the fan and helps to slow down the airflow, increasing its pressure. The diffuser is designed to maximize the efficiency of the fan.
5. Outlet guide vanes: These are passive devices that help to direct the airflow out of the fan, ensuring that it exits the fan in a consistent and efficient manner.
6. Bearings: The fan rotor is supported by bearings, which allow it to rotate smoothly and efficiently. The bearings are usually lubricated with oil or grease.
7. Shaft: The shaft connects the fan rotor to the motor, transmitting the rotational energy from the motor to the fan.
8. Coupling: The coupling connects the motor to the shaft, ensuring that the rotational energy is transmitted efficiently and smoothly.
9. Housing: The housing encloses the fan, motor, and other components, protecting them from the environment and ensuring that the system operates efficiently.

Potential failure modes for an induced draft fan system include:

1. Fan failure: The fan can fail due to worn-out blades, broken fan shaft, or damaged fan housing.
2. Motor failure: The motor can fail",0,induceddraftfan
216,How do the severity and detectability ratings of IGVs and OGVs help in predicting and preventing failures?,"  Induced draft fans are an essential component in various industrial processes, and their reliability is critical to ensure uninterrupted operations. Failure modes and effects analysis (FMEA) is a powerful tool that helps reliability engineers like myself to identify and mitigate potential failures. In the context of induced draft fans, FMEA helps to identify possible failure modes, their severity, and detectability.

Severity ratings are a measure of the potential impact of a failure on the process, people, and environment. In the case of induced draft fans, severity ratings are typically high for failure modes that can cause damage to the fan blades, motor, or other critical components. For example, a broken fan blade can cause damage to downstream equipment, leading to costly repairs and downtime. Similarly, a failed motor can result in the fan stopping, causing a process upset or even a safety issue.

Detectability ratings, on the other hand, indicate how easily a failure mode can be detected before it occurs. In the case of induced draft fans, detectability ratings are typically higher for failure modes that can be detected through routine maintenance activities, such as vibration analysis, thermal imaging, or oil analysis. For example, bearing faults can be detected through vibration analysis, while overheating can be detected through thermal imaging.

By analyzing the severity and detectability ratings of various failure modes, reliability engineers can prioritize maintenance activities and implement preventive measures to mitigate potential failures. For example, if a bearing fault has a high severity rating and a low detectability rating, it may be necessary to perform regular vibration analysis to detect any abnormalities before a failure occurs. Similarly, if a fan blade has a high severity rating and a high detectability rating, it may be possible to detect any damage or wear through routine visual inspections.

In the case of induced draft fans, some common failure modes, their severity, and detectability ratings are as follows:

1. Broken fan blades: Severity rating - 9/10; Detectability rating - 8/10
2. Motor failure: Severity rating - 9/10; Detectability rating - 7/10
3. Bearing faults: Severity rating -",1,induceddraftfan
91,"How common are imbalance, misalignment, loose or worn-out components, resonance, and aerodynamic imbalance in induced draft fans, and what are the typical causes of these issues?","  Induced draft fans are commonly used in various industrial applications, such as power generation, chemical processing, and HVAC systems. Like any other mechanical equipment, induced draft fans are susceptible to various failure modes that can affect their performance, efficiency, and reliability. Here are some common failure modes, their causes, and detection methods for induced draft fans:

1. Imbalance:

Imbalance is a common issue in induced draft fans, which can lead to uneven distribution of stress on the fan blades, hub, and shaft. This can cause the fan to vibrate excessively, leading to premature wear and tear on the bearings and other components. Imbalance can be caused by various factors, such as:

* Uneven distribution of dust or debris on the blades
* Warped or damaged blades
* Misaligned fan blades
* Loose or worn-out fan mounts

Detection methods:

* Vibration analysis: Measure the vibration levels of the fan using accelerometers or proximity probes to detect any abnormalities.
* Visual inspection: Inspect the fan blades for any signs of wear, warping, or damage. Check the fan mounts for looseness or wear.
* Balancing test: Perform a balancing test to determine if the fan is properly balanced.
2. Misalignment:

Misalignment is another common issue in induced draft fans, which can cause uneven wear on the fan blades, bearings, and other components. Misalignment can be caused by various factors, such as:

* Incorrect installation
* Wear and tear on the fan bearings
* Shaft deflection
* Incorrect fan blade pitch

Detection methods:

* Laser alignment: Use a laser alignment tool to measure the alignment of the fan shaft and blades.
* Vibration analysis: Measure the vibration levels of the fan to detect any abnormalities.
* Visual inspection: Inspect the fan blades for any signs of uneven wear. Check the fan bearings for any signs of wear or damage.
3. Loose or worn-out components:

Loose or worn-out components can cause induced draft fans to vibr",1,induceddraftfan
34,"Are there any specific challenges or limitations when it comes to implementing anomaly detection systems in induced draft fans? For example, are there any issues with data quality, sensor placement, or cost that need to be considered?","  Yes, there are specific challenges and limitations when it comes to implementing anomaly detection systems in induced draft fans. Here are some of the key challenges:

1. Data Quality: Induced draft fans are often located in harsh environments with high temperatures, humidity, and vibrations, which can affect the quality of the data collected by sensors. Noise, missing data, and sensor malfunctions can make it difficult to accurately detect anomalies.
2. Sensor Placement: Induced draft fans are complex machines with many components, including blades, hubs, bearings, and motors. Sensors need to be placed in the right locations to capture relevant data, but this can be challenging due to the size and geometry of the fan. Additionally, some components may be difficult to access, making it hard to install sensors.
3. Cost: Induced draft fans are often large and expensive pieces of equipment, and the cost of installing sensors and implementing anomaly detection systems can be prohibitive. This can make it difficult to justify the investment, especially if the fan is already operating reliably.
4. Complexity of Fan Dynamics: Induced draft fans are complex systems with many interacting components. Understanding the relationships between these components and how they affect fan performance is crucial for detecting anomalies. However, this complexity can make it difficult to develop accurate models and algorithms for anomaly detection.
5. Limited Visibility: Induced draft fans are often located in remote areas or inside large industrial facilities, making it difficult to monitor them continuously. This limited visibility can make it hard to detect anomalies before they become severe.
6. Maintenance Accessibility: Induced draft fans are often located in hard-to-reach areas, making it difficult to perform maintenance and repairs. This can limit the ability to detect and address anomalies before they cause significant problems.
7. Variability in Operating Conditions: Induced draft fans operate under varying conditions, such as changing temperatures, humidity, and airflow rates. This variability can make it challenging to distinguish between normal and abnormal behavior, especially if the anomaly detection system is not trained on data from similar operating conditions.
8. Limited Historical Data: Induced draft fans are often custom",1,induceddraftfan
71,"Can you provide examples of how the key performance indicators (KPIs) such as pressure drop, airflow rate, and vibration can help identify potential issues before they become major failures?","  Certainly! Induced draft fans are an essential component in various industrial processes, and monitoring their performance is crucial to avoid unexpected failures. Key Performance Indicators (KPIs) are vital in identifying potential issues before they become major failures. Here are some examples of how KPIs can help identify potential issues in induced draft fans:

1. Pressure Drop:
	* Increase in pressure drop across the fan can indicate dirty or clogged filters, which can lead to reduced airflow and increased strain on the fan motor.
	* Monitoring pressure drop can help identify the need for filter cleaning or replacement, which can prevent fan failures due to excessive strain.
2. Airflow Rate:
	* Decrease in airflow rate can indicate worn or damaged fan blades, which can lead to reduced fan efficiency and increased energy consumption.
	* Monitoring airflow rate can help identify worn or damaged fan blades, allowing for proactive replacement before they fail completely.
3. Vibration:
	* Increased vibration can indicate imbalance, misalignment, or bearing wear in the fan rotor. These issues can lead to premature bearing failure, which can cause catastrophic fan failure.
	* Monitoring vibration can help identify issues with the fan rotor, allowing for proactive maintenance to address imbalance, misalignment, or bearing wear before they cause bearing failure.

Example of FMEA for Induced Draft Fan:

Failure Mode: Bearing Failure

* Failure Reason: Increased vibration due to misalignment
* Failure Code: 123456789
* Degradation Mechanism: Wear and tear on the bearing due to misalignment, leading to increased vibration and eventual bearing failure.
* Severity: 9/10 (Catastrophic failure can cause complete shutdown of the process)
* Detectability: 7/10 (Vibration can be detected through regular monitoring, but it may not be noticed until it's too late)
* Risk Priority Number (RPN): 63 (High risk, requires immediate attention)

In this example, the F",1,induceddraftfan
183,Can you provide examples of specific vibration patterns or noise levels that may indicate a potential failure in a Centrifugal Compressor?,"  Certainly! Centrifugal compressors are complex machines with various components that can fail and cause the entire system to shut down. Here are some examples of specific vibration patterns or noise levels that may indicate a potential failure in a centrifugal compressor:

1. Imbalance: An imbalance in the compressor's impeller or rotor can cause vibration in the range of 10-20 Hz, which can be detected by accelerometers mounted on the compressor casing or bearing housings. This vibration can be caused by wear on the impeller blades, loose or damaged bolts, or misaligned rotor discs.
2. Misaligned rotor: A misaligned rotor can cause vibration in the range of 1-5 Hz, which can be detected by accelerometers mounted on the compressor casing or bearing housings. This vibration can be caused by wear on the bearings, misaligned rotor discs, or a skewed shaft.
3. Worn or damaged bearings: Worn or damaged bearings can cause vibration in the range of 1-10 Hz, which can be detected by accelerometers mounted on the bearing housings. This vibration can be caused by wear on the bearing races, damaged or worn-out bearing cages, or contaminated lubrication.
4. Loose or damaged blades: Loose or damaged blades can cause vibration in the range of 10-20 Hz, which can be detected by accelerometers mounted on the compressor casing or bearing housings. This vibration can be caused by wear on the blade roots, loose or damaged blade attachments, or damaged blade profiles.
5. Clogged inlet filter: A clogged inlet filter can cause a pressure drop across the compressor, leading to increased vibration and noise levels. This can be detected by pressure sensors installed upstream and downstream of the compressor.
6. Discharge pressure fluctuations: Fluctuations in the discharge pressure can cause vibration in the range of 1-10 Hz, which can be detected by pressure sensors installed downstream of the compressor. This vibration can be",1,centrifugalcompressor
118,What are the typical lead times for repairing or replacing failed components in a centrifugal compressor? How do these lead times impact the predictive maintenance schedule?,"  The lead times for repairing or replacing failed components in a centrifugal compressor can vary depending on the type and severity of the failure, as well as the availability of spare parts and the level of expertise of the maintenance team. However, here are some typical lead times for common failure modes in a centrifugal compressor:

1. Bearing failure: Bearing failure is a common issue in centrifugal compressors, and the lead time for replacing a failed bearing can range from a few days to several weeks, depending on the availability of the specific bearing type and the maintenance team's experience. In some cases, the bearing may need to be custom-made, which can extend the lead time to several months.
2. Seal failure: Seal failure can occur due to wear and tear, overheating, or contamination. The lead time for replacing a failed seal can range from a few days to a week, depending on the availability of the specific seal type and the maintenance team's experience.
3. Impeller failure: Impeller failure can occur due to erosion, corrosion, or mechanical damage. The lead time for replacing a failed impeller can range from a few weeks to several months, depending on the availability of the specific impeller design and the maintenance team's experience. In some cases, the impeller may need to be custom-made, which can extend the lead time.
4. Compressor housing failure: Compressor housing failure can occur due to corrosion, erosion, or mechanical damage. The lead time for repairing or replacing a failed compressor housing can range from a few weeks to several months, depending on the extent of the damage and the maintenance team's experience.
5. Electric motor failure: Electric motor failure can occur due to overheating, overloading, or electrical faults. The lead time for replacing a failed electric motor can range from a few days to several weeks, depending on the availability of the specific motor type and the maintenance team's experience.

These lead times can impact the predictive maintenance schedule in several ways:

1. Planning and scheduling: Maintenance personnel need to plan and schedule the maintenance activities well in advance to ensure that the required spare parts and resources are available when needed. This includes sched",1,centrifugalcompressor
124,"What are the typical ambient temperature ranges that a centrifugal compressor can operate in, and how do temperature fluctuations affect its performance and reliability?","  Centrifugal compressors are typically designed to operate in a wide range of ambient temperatures, from -40°C to 120°C (-40°F to 248°F). However, the optimal operating temperature range for a centrifugal compressor is generally between 15°C to 40°C (59°F to 104°F).

Temperature fluctuations can affect the performance and reliability of a centrifugal compressor in several ways:

1. Viscosity: Temperature changes can alter the viscosity of the fluid being compressed, which can affect the compressor's ability to pump the fluid efficiently. Increased viscosity can result in reduced flow rates, increased pressure drop, and decreased compressor efficiency.
2. Density: Temperature changes can also affect the density of the fluid, which can impact the compressor's ability to compress the fluid. Changes in density can result in changes in the compressor's capacity and efficiency.
3. Lubrication: Temperature fluctuations can affect the lubrication of the compressor's bearings and other moving parts. Extreme temperatures can cause the lubricant to thicken or thin, leading to reduced lubrication and increased wear on the components.
4. Materials: Temperature fluctuations can also affect the materials used in the compressor's construction. For example, extreme temperatures can cause thermal stress and fatigue in the compressor's components, leading to premature failure.
5. Sealing: Temperature fluctuations can affect the sealing of the compressor's components, such as the impeller and diffuser. Changes in temperature can cause the seals to shrink or expand, leading to reduced compressor efficiency and increased leakage.

In terms of detecting potential failures before they occur, preventive maintenance techniques such as vibration analysis, oil analysis, and thermography can be used to monitor the compressor's condition and identify potential issues before they become major failures.

Severity and ability to detect failures before they happen:

1. Vibration analysis: Vibration analysis can detect potential issues such as imbalance, mis",1,centrifugalcompressor
170,"Can you provide more information on the common causes of bearing failure in centrifugal compressors, such as lubrication issues or misalignment?","  Certainly! Centrifugal compressors are critical assets in many industrial processes, and their reliability is crucial to maintaining production uptime and avoiding costly repairs. Bearing failure is a common issue in centrifugal compressors, and it can be caused by a variety of factors. Here are some of the most common causes of bearing failure in centrifugal compressors:

1. Lubrication Issues:
Lubrication is essential to prevent wear and tear on the bearings. Inadequate lubrication, contamination of the lubricant, or excessive heat buildup can cause the bearings to fail prematurely. Lubrication issues can arise from a variety of sources, including:
* Insufficient lubricant supply
* Incorrect lubricant type or viscosity
* Lubricant leakage or contamination
* Inadequate sealing of the bearing compartment
* High temperatures or humidity affecting lubricant performance
2. Misalignment:
Misalignment of the compressor's shaft and bearings can cause uneven wear on the bearings, leading to premature failure. Misalignment can occur due to:
* Incorrect installation or maintenance
* Wear and tear on the shaft or bearings
* Incorrect alignment of the compressor's couplings or pulleys
* Soft foot or foundation problems
3. Overloading:
Operating the compressor beyond its design capacity can lead to excessive wear on the bearings, causing them to fail prematurely. Overloading can occur due to:
* Increased process demand
* Reduced capacity due to fouling or clogging
* Incorrect sizing of the compressor for the application
4. Contamination:
Contamination of the bearings by foreign particles or debris can cause wear and tear, leading to premature failure. Contamination can enter the bearing compartment through various sources, including:
* Ingress of dirt, dust, or moisture through poor sealing
* Incorrect handling or maintenance practices
* Wear and tear on the compressor's components, such as the impeller or diffuser
5. Fatigue:
F",1,centrifugalcompressor
15,"Are there any specific failure modes that are more critical than others? For example, is impeller failure more critical than diffuser failure?","  Yes, there are specific failure modes that are more critical than others in a centrifugal compressor. The most critical failure modes in a centrifugal compressor are typically related to the rotating components, such as the impeller, shaft, and bearings.

Impeller failure is considered one of the most critical failure modes in a centrifugal compressor, as it can lead to a complete failure of the compressor and can cause significant damage to the surrounding equipment. The impeller is responsible for imparting velocity to the fluid being compressed, and any failure can result in a loss of compression efficiency, leading to reduced output and increased energy consumption.

Some common failure modes for the impeller include:

* Erosion or wear of the blades due to the high-velocity fluid flow
* Fatigue failure of the blades due to repeated stress cycles
* Cracking or breaking of the blades due to excessive vibration or misalignment
* Corrosion or erosion of the impeller hub or shroud

Shaft failure is another critical failure mode in a centrifugal compressor, as it can also lead to a complete failure of the compressor. The shaft is responsible for transmitting the rotational energy from the motor to the impeller, and any failure can result in a loss of compression efficiency and reduced output.

Some common failure modes for the shaft include:

* Fatigue failure due to repeated stress cycles
* Misalignment or vibration, leading to bearing failure
* Corrosion or erosion of the shaft surface
* Seal failure, leading to leakage of fluid and reduced compression efficiency

Bearing failure is also a critical failure mode in a centrifugal compressor, as it can lead to a complete failure of the compressor and can cause significant damage to the surrounding equipment. The bearings are responsible for supporting the rotating shaft and allowing it to rotate smoothly, and any failure can result in a loss of compression efficiency and reduced output.

Some common failure modes for the bearings include:

* Fatigue failure due to repeated stress cycles
* Misalignment or vibration, leading to bearing failure
* Corrosion or erosion of the bearing surface
* Lubrication failure, leading to increased",0,centrifugalcompressor
128,"How do different operating conditions, such as changes in temperature, pressure, or flow rate, affect the likelihood of anomalies or failures in centrifugal compressors?","  Changes in operating conditions, such as temperature, pressure, or flow rate, can significantly impact the likelihood of anomalies or failures in centrifugal compressors. Here are some possible effects of operating conditions on the reliability of centrifugal compressors:

1. Temperature:

a. Increased temperature can lead to increased wear on bearings and seals, which can cause lubrication failures and eventually lead to bearing failure.

b. Higher temperatures can also cause the compressor's components to expand, which can lead to increased vibration and potential failure of the compressor's shaft or impeller.

c. On the other hand, low temperatures can cause the lubricant to thicken, leading to reduced lubrication and increased wear on moving parts.

2. Pressure:

a. Increased pressure can lead to increased stress on the compressor's components, such as the impeller, diffuser, and volute. This can cause fatigue failures, especially in components with existing cracks or weaknesses.

b. High pressure can also cause the compressor's seals to fail, leading to leakage and reduced efficiency.

c. Conversely, low pressure can cause the compressor's performance to degrade, leading to reduced efficiency and potential failure.

3. Flow rate:

a. Increased flow rate can lead to increased stress on the compressor's components, particularly the impeller and diffuser. This can cause fatigue failures, especially in components with existing cracks or weaknesses.

b. High flow rates can also cause the compressor's seals to fail, leading to leakage and reduced efficiency.

c. Conversely, low flow rates can cause the compressor's performance to degrade, leading to reduced efficiency and potential failure.

4. Other operating conditions:

a. Changes in humidity or contamination can affect the compressor's performance and reliability. For example, high humidity can cause corrosion, while contamination can cause clogging and reduced efficiency.

b. Changes in the compressor's speed or load can also affect its reliability. For example, operating the compressor",1,centrifugalcompressor
