id,questions,answers,round,asset
92,How will the sensor data be cleaned and preprocessed before training the anomaly detection model? Will any filters or feature extraction techniques be applied to the data?,"  Background Document: Wind Turbine Gearbox Anomaly Detection

Introduction:
The objective of this project is to develop an anomaly detection model using real-time time series sensor data obtained from IoT/OT systems to detect potential failures in wind turbine gearboxes. The model will be trained on clean and preprocessed data to ensure accurate and reliable results. This document outlines the approach for cleaning and preprocessing the sensor data, as well as the techniques that will be applied to the data before training the anomaly detection model.

Sensor Data Collection:
The sensor data will be collected from a variety of sources, including temperature sensors, pressure sensors, vibration sensors, and current sensors. The data will be collected at regular intervals, and the sampling rate will be determined based on the specific requirements of the wind turbine gearbox and the sensors used.

Data Cleaning:
The collected sensor data may contain noise, outliers, and missing values, which can affect the accuracy of the anomaly detection model. Therefore, it is essential to clean and preprocess the data before training the model. The following steps will be taken to clean the data:

1. Remove missing values: Missing values can be replaced with the mean or median value of the corresponding sensor data or imputed using a suitable method.
2. Remove outliers: Outliers can be detected using statistical methods such as the Z-score method or machine learning algorithms such as Isolation Forest. Outliers that are not part of the normal operating conditions will be removed from the dataset.
3. Filter noise: Noise can be filtered using techniques such as moving average, exponential smoothing, or wavelet denoising. The appropriate filter will be selected based on the characteristics of the sensor data and the specific requirements of the wind turbine gearbox.
4. Normalize data: The sensor data may have different scales and units, which can affect the model's performance. Therefore, it is essential to normalize the data to a common scale, such as 0 to 1, to ensure that all features have equal importance.

Feature Extraction:
After cleaning the data, the next step is to extract relevant features that can help identify anomalies in the wind turbine gearbox. The following features will be extracted from the sensor data:

1. Time-domain features: These features will capture the temporal characteristics of the sensor data, such as mean, standard deviation, and variance.
2. Frequency-domain features: These features will capture the spectral characteristics of the sensor data, such as peak frequency and spectral power.
3. Time-frequency features: These features will capture the time-varying frequency content of the sensor data, such as wavelet coefficients.
4. Machine learning features: These features will be extracted using machine learning algorithms, such as autoencoders or Isolation Forest, to capture complex patterns in the data.

Data Preprocessing:
After extracting the relevant features, the data will be preprocessed to prepare it for training the anomaly detection model. The following steps will be taken:

1. Feature scaling: The features will be scaled to a common range, such as 0 to 1, to ensure that all features have equal importance.
2. Feature selection: The most relevant features will be selected based on their ability to detect anomalies in the wind turbine gearbox.
3. Data splitting: The dataset will be split into training, validation, and testing sets to evaluate the performance of the anomaly detection model.

Conclusion:
The sensor data collected from wind turbine gearboxes requires cleaning and preprocessing to remove noise, outliers, and missing values. Relevant features will be extracted from the sensor data, and the data will be preprocessed to prepare it for training the anomaly detection model. The approach outlined in this document will ensure that the anomaly detection model is trained on accurate and reliable data, which can help detect potential failures in the wind turbine gearbox and prevent unplanned downtime.",1,windturbinegearbox
59,"Can you provide more information about the specific sensors that will be used to collect the sensor data? For example, what type of sensors will be used to measure temperature, vibration, and noise?","  Background Document: Wind Turbine Gearbox Anomaly Detection using Real-time Sensor Data

Introduction:
The objective of this project is to develop an anomaly detection model using real-time time series sensor data from a wind turbine gearbox. The model will identify unusual patterns or behaviors that may indicate a potential failure or abnormality in the gearbox, allowing for proactive maintenance and minimizing downtime.

Sensor Data:
The following sensors will be used to collect data from the wind turbine gearbox:

1. Temperature sensors: These will measure the temperature of various components in the gearbox, such as bearings, gears, and the lubrication system. Temperature sensors can detect anomalies in temperature readings that may indicate overheating or cooling issues.
2. Vibration sensors: These will measure the vibration levels of the gearbox components, such as the bearings, gears, and housing. Vibration sensors can detect anomalies in vibration patterns that may indicate misalignment, imbalance, or bearing faults.
3. Noise sensors: These will measure the noise levels in the gearbox, which can indicate abnormalities in the lubrication system, bearing faults, or gear damage.
4. Pressure sensors: These will measure the pressure levels in the lubrication system, which can indicate anomalies in the oil pressure, flow rate, or leakage.
5. Acceleration sensors: These will measure the acceleration levels of the gearbox components, which can indicate anomalies in the dynamic behavior of the gearbox, such as imbalance, misalignment, or bearing faults.
6. Current sensors: These will measure the electrical current flowing through the gearbox's motors, which can indicate anomalies in the motor's performance, such as overheating, overloading, or electrical faults.
7. Position sensors: These will measure the position and angle of the gearbox components, such as the blades, hub, and tower. Position sensors can detect anomalies in the position and angle of the components, which may indicate misalignment, imbalance, or structural damage.

Additional Information:
The sensor data will be collected in real-time, and the anomaly detection model will be trained on a combination of historical data and real-time data. The model will be trained to detect anomalies in the sensor data and provide early warnings of potential failures. The model will also provide recommendations for maintenance and repairs.

The specific failure modes that the model will be designed to detect include:

1. Bearing faults
2. Gear damage
3. Lubrication system failures
4. Motor failures
5. Structural damage

The ability of the sensor data to detect these failure modes will depend on the quality and accuracy of the data, as well as the specific sensors used. For example, temperature sensors can detect overheating or cooling issues, while vibration sensors can detect misalignment or imbalance. Noise sensors can detect abnormalities in the lubrication system, while pressure sensors can detect anomalies in the oil pressure or flow rate. Acceleration sensors can detect dynamic behavior anomalies, while current sensors can detect electrical faults. Position sensors can detect misalignment or imbalance in the blades, hub, or tower.

In summary, the combination of temperature, vibration, noise, pressure, acceleration, current, and position sensors will provide a comprehensive view of the wind turbine gearbox's health, enabling the anomaly detection model to detect potential failures and provide early warnings for maintenance and repairs.",1,windturbinegearbox
171,Can you provide examples of specific patterns or anomalies in the data that would indicate a failure in the gearbox?,"  Sure, I can provide some examples of specific patterns or anomalies in the data that would indicate a failure in the wind turbine gearbox.

Firstly, it's important to note that the sensor data obtained from IoT/OT systems can be noisy and may contain outliers or anomalies that are not necessarily indicative of a failure. Therefore, it's crucial to carefully evaluate the data and identify patterns that are indicative of a failure.

With that said, here are some examples of specific patterns or anomalies in the data that could indicate a failure in the wind turbine gearbox:

1. Increased vibration: Vibration sensors can detect unusual vibration patterns in the gearbox, which could indicate a failure in the bearings, gears, or other components. For example, an increase in vibration amplitude or a change in vibration frequency could indicate a failure.
2. Temperature changes: Temperature sensors can detect changes in the temperature of the gearbox, which could indicate a failure in the lubrication system or overheating due to excessive friction. For example, a sudden increase in temperature could indicate a failure in the lubrication system, while a gradual increase in temperature could indicate overheating.
3. Oil leakage: Oil leakage sensors can detect oil leakage in the gearbox, which could indicate a failure in the seals or gaskets. For example, a sudden increase in oil leakage could indicate a failure in the seals or gaskets.
4. Gearbox noise: Acoustic sensors can detect unusual noise patterns in the gearbox, which could indicate a failure in the gears or bearings. For example, a change in the noise pattern or an increase in noise amplitude could indicate a failure.
5. Reduced power output: Power output sensors can detect a reduction in power output, which could indicate a failure in the gearbox or other components of the wind turbine. For example, a sudden reduction in power output could indicate a failure in the gearbox or a decrease in wind speed.
6. Increased wear and tear: Wear and tear sensors can detect increased wear and tear on the gearbox components, which could indicate a failure due to excessive friction or abrasion. For example, an increase in the wear and tear rate could indicate a failure in the bearings or gears.
7. Misalignment: Misalignment sensors can detect misalignment between the gearbox and the rotor, which could indicate a failure in the coupling or bearing. For example, a sudden change in misalignment could indicate a failure in the coupling or bearing.
8. Electrical anomalies: Electrical sensors can detect electrical anomalies in the gearbox, such as increased electrical resistance or voltage fluctuations, which could indicate a failure in the electrical components. For example, a sudden increase in electrical resistance could indicate a failure in the electrical components.

These are just a few examples of specific patterns or anomalies in the data that could indicate a failure in the wind turbine gearbox. The specific patterns or anomalies that are indicative of a failure will depend on the specific sensor data and the domain knowledge of the subject matter experts.",1,windturbinegearbox
82,"How do oil condition sensors detect changes in the condition of the lubricating oil? Are there any specific oil parameters that are monitored, such as viscosity or contamination?","  Background Document:

Introduction:
The industrial asset class for this analysis is wind turbine gearbox. The gearbox is a critical component in the wind turbine system, and its failure can lead to significant downtime and maintenance costs. One of the key components of the gearbox is the lubricating oil, which plays a crucial role in ensuring the smooth operation of the gearbox. In this document, we will discuss how oil condition sensors detect changes in the condition of the lubricating oil and the specific oil parameters that are monitored.

Oil Condition Sensors:
Oil condition sensors are used to monitor the condition of the lubricating oil in the gearbox. These sensors are designed to detect changes in the oil's physical and chemical properties, which can indicate potential failures or abnormalities in the gearbox. The most common oil condition sensors used in wind turbine gearboxes include:

1. Oil Temperature Sensors: These sensors measure the temperature of the lubricating oil in the gearbox. An increase in oil temperature can indicate a potential failure in the gearbox, such as overheating or friction.
2. Oil Pressure Sensors: These sensors measure the pressure of the lubricating oil in the gearbox. A decrease in oil pressure can indicate a potential failure in the gearbox, such as a leak or low oil levels.
3. Oil Viscosity Sensors: These sensors measure the viscosity of the lubricating oil in the gearbox. Viscosity is a measure of a fluid's resistance to flow. An increase in oil viscosity can indicate a potential failure in the gearbox, such as contamination or degradation of the oil.
4. Oil Contamination Sensors: These sensors measure the level of contamination in the lubricating oil. Contamination can come from a variety of sources, including dirt, dust, and metal shavings. An increase in oil contamination can indicate a potential failure in the gearbox, such as wear and tear on the gearbox components.

Specific Oil Parameters:
The specific oil parameters that are monitored by oil condition sensors in wind turbine gearboxes include:

1. Oil Temperature: As mentioned earlier, oil temperature sensors measure the temperature of the lubricating oil in the gearbox. An increase in oil temperature can indicate a potential failure in the gearbox, such as overheating or friction.
2. Oil Pressure: Oil pressure sensors measure the pressure of the lubricating oil in the gearbox. A decrease in oil pressure can indicate a potential failure in the gearbox, such as a leak or low oil levels.
3. Oil Viscosity: Oil viscosity sensors measure the viscosity of the lubricating oil in the gearbox. An increase in oil viscosity can indicate a potential failure in the gearbox, such as contamination or degradation of the oil.
4. Oil Contamination: Oil contamination sensors measure the level of contamination in the lubricating oil. An increase in oil contamination can indicate a potential failure in the gearbox, such as wear and tear on the gearbox components.

Conclusion:
Oil condition sensors play a critical role in detecting changes in the condition of the lubricating oil in wind turbine gearboxes. These sensors monitor specific oil parameters, such as oil temperature, pressure, viscosity, and contamination, to detect potential failures or abnormalities in the gearbox. By monitoring these parameters, oil condition sensors can help prevent unexpected downtime and reduce maintenance costs.",1,windturbinegearbox
76,"How do the sensors and data analysis algorithms handle the complex interactions between different components of the wind turbine system, such as the gearbox, blades, and generator?","  Background Document: Wind Turbine Gearbox Anomaly Detection

Introduction:
The objective of this document is to provide an overview of the anomaly detection process for a wind turbine gearbox using real-time time series sensor data. The document will outline the important components, failure modes, and sensor data required to detect anomalies in the gearbox system.

Important Components:
The wind turbine gearbox system consists of several critical components that require monitoring to ensure efficient and safe operation. The main components include:

1. Gearbox: The gearbox is the primary component that requires monitoring. It contains a series of gears that transmit power from the rotor to the generator. The gearbox is subject to various failure modes, such as bearing faults, gear wear, and oil leakages.
2. Blades: The blades are responsible for capturing the wind energy and converting it into rotational energy. The blades are connected to the gearbox through a hub. The blades' pitch and yaw are critical parameters that affect the gearbox's operation.
3. Generator: The generator converts the mechanical energy from the gearbox into electrical energy. The generator's performance is critical to the overall efficiency of the wind turbine.

Failure Modes:
The wind turbine gearbox system can experience various failure modes that can impact its performance and safety. Some of the common failure modes include:

1. Bearing faults: The gearbox contains several bearings that can fail due to wear and tear, overloading, or poor lubrication. Bearing faults can lead to excessive vibration, noise, and heat generation, which can cause catastrophic failures.
2. Gear wear: The gears in the gearbox can wear out due to friction and abrasion. Gear wear can lead to inefficient power transmission, increased vibration, and reduced system performance.
3. Oil leakages: The gearbox contains lubricating oil that can leak due to various reasons such as worn seals, damaged gaskets, or overfilling. Oil leakages can lead to reduced lubrication, increased wear, and contamination of the surroundings.
4. Misalignment: The blades and gearbox must be properly aligned to ensure efficient power transmission. Misalignment can cause excessive vibration, wear, and reduced system performance.

Sensor Data:
To detect anomalies in the wind turbine gearbox system, various sensors are installed to monitor the critical components and their performance. Some of the common sensors include:

1. Vibration sensors: Vibration sensors are installed on the gearbox, blades, and generator to monitor the vibration levels. Vibration data can indicate bearing faults, gear wear, and misalignment.
2. Temperature sensors: Temperature sensors are installed to monitor the oil temperature, bearing temperature, and gearbox temperature. Temperature data can indicate overheating, which can be a sign of bearing faults, gear wear, or oil leakages.
3. Pressure sensors: Pressure sensors are installed to monitor the oil pressure in the gearbox. Pressure data can indicate oil leakages, low oil levels, or blocked oil filters.
4. Speed sensors: Speed sensors are installed to monitor the rotational speed of the blades, gearbox, and generator. Speed data can indicate misalignment, gear wear, or generator issues.
5. Acoustic sensors: Acoustic sensors are installed to monitor the noise levels in the wind turbine. Acoustic data can indicate bearing faults, gear wear, or other mechanical issues.

Data Analysis Algorithms:
The sensor data collected from the wind turbine gearbox system is analyzed using various algorithms to detect anomalies and predict potential failures. Some of the common algorithms include:

1. Time-series analysis: Time-series analysis is used to detect patterns and trends in the sensor data. Time-series models, such as ARIMA, SARIMA, and Exponential Smoothing, can forecast future values and detect anomalies.
2. Machine learning algorithms: Machine learning algorithms, such as Random Forest, Support Vector Machines, and Neural Networks, can be trained on historical data to detect patterns and anomalies. These algorithms can also predict potential failures based on the sensor data.
3. Signal processing algorithms: Signal processing algorithms, such as Fast Fourier Transform (FFT), can be used to analyze the vibration and acoustic data. These algorithms can detect frequency components that indicate bearing faults, gear wear, or other mechanical issues.

Conclusion:
The wind turbine gearbox system is a critical component of the wind energy conversion process. The system requires real-time monitoring to detect anomalies and predict potential failures. The sensors and data analysis algorithms used in the system must be carefully selected and calibrated to ensure accurate and reliable detection of anomalies. By monitoring the critical components, failure modes, and sensor data, the wind turbine gearbox system can operate efficiently and safely, ensuring maximum energy production and minimal downtime.",1,windturbinegearbox
115,"How do you handle data analysis and interpretation for wind turbine gearbox maintenance, and what tools or software do you typically use for this purpose?","  Background Document: Wind Turbine Gearbox Maintenance and Data Analysis

Introduction:
Wind turbine gearboxes are critical components in wind energy production, and their maintenance is essential to ensure optimal performance and minimize downtime. Data analysis and interpretation play a vital role in identifying potential issues and predicting maintenance needs. This document outlines the approach and tools used in data analysis and interpretation for wind turbine gearbox maintenance.

Important Components for Anomaly Detection:
The following components are crucial for anomaly detection in wind turbine gearboxes:

1. Vibration sensors: Accelerometers and gyroscopes measure vibration and oscillation patterns in the gearbox, which can indicate misalignment, imbalance, or bearing faults.
2. Temperature sensors: Thermocouples and infrared cameras monitor the temperature of the gearbox and its components, helping to identify overheating, which can be a sign of lubrication issues or mechanical failure.
3. Oil sensors: Sensors measure the oil level, pressure, and viscosity, providing information on lubrication health and potential leaks.
4. Acoustic sensors: Acoustic emission sensors detect unusual sounds or noise patterns that may indicate gearbox faults, such as bearing or gear damage.
5. Pressure sensors: Pressure sensors monitor the hydraulic pressure in the gearbox, which can help identify issues with the lubrication system or other components.

Failure Modes:
The following failure modes are critical for anomaly detection in wind turbine gearboxes:

1. Bearing faults: Faulty bearings can cause vibration, overheating, and noise, leading to gearbox failure.
2. Gear damage: Worn or damaged gears can cause vibration, noise, and reduced performance.
3. Lubrication issues: Insufficient lubrication or oil leaks can lead to overheating, wear, and tear on components, and ultimately, gearbox failure.
4. Misalignment: Misaligned gearbox components can cause vibration, noise, and reduced performance.
5. Imbalance: Imbalanced rotor blades can cause vibration and reduced performance.

Data Analysis Techniques:
The following data analysis techniques are typically used for wind turbine gearbox maintenance:

1. Time-series analysis: This method is used to analyze data collected over time to identify patterns, trends, and anomalies in sensor readings.
2. Machine learning: Machine learning algorithms can be trained on historical data to recognize patterns and detect anomalies in real-time data.
3. Signal processing: Signal processing techniques, such as Fast Fourier Transform (FFT), are used to analyze vibration and acoustic data to identify frequency components and patterns indicative of gearbox faults.
4. Data visualization: Data visualization tools are used to present the data in a meaningful way, helping to identify trends, patterns, and anomalies.

Software and Tools:
The following software and tools are commonly used for wind turbine gearbox maintenance data analysis:

1. Predixion Software: Predixion offers a suite of machine learning software for predictive maintenance, including anomaly detection and predictive modeling.
2. Splunk: Splunk is a data analytics platform that enables users to collect, index, and analyze large amounts of data from various sources, including sensor data.
3. Tableau: Tableau is a data visualization tool that allows users to create interactive, graphical representations of data, making it easier to identify trends and patterns.
4. MATLAB: MATLAB is a programming environment and toolbox for data analysis, signal processing, and machine learning.
5. Python: Python is a popular programming language used for data analysis, machine learning, and signal processing.

Conclusion:
Effective data analysis and interpretation are critical for wind turbine gearbox maintenance. By leveraging the right tools and techniques, operators can identify potential issues before they become major problems, reducing downtime and improving overall efficiency.",1,windturbinegearbox
