id,questions,answers,round,asset
65,"Can you discuss any maintenance or repair strategies that have been used to address failures in the Water-Cooled Condenser, and how effective have these strategies been in preventing future failures?","  Sure, I can provide information on failure modes, effects, and maintenance strategies for a Water-Cooled Condenser.

Failure Modes and Effects:

1. Tube Failure: The condenser tubes are susceptible to failure due to corrosion, erosion, or mechanical damage. Failure can occur due to leakage, rupture, or plugging of tubes, which can lead to a decrease in heat transfer efficiency and ultimately result in unit trips or shutdowns.
2. Tube Sheet Failure: The tube sheet is a critical component that supports the condenser tubes. Failure can occur due to corrosion, erosion, or mechanical stress, leading to tube leaks or ruptures.
3. Condenser Coil Failure: The condenser coils are responsible for dissipating heat from the condensate to the cooling water. Failure can occur due to corrosion, fouling, or mechanical damage, leading to a decrease in heat transfer efficiency.
4. Cooling Water Pump Failure: The cooling water pump is responsible for circulating cooling water through the condenser. Failure can occur due to wear and tear, leading to decreased flow rates and inefficient heat transfer.
5. Dirty or Clogged Condenser Tubes: Dirty or clogged tubes can reduce heat transfer efficiency, leading to decreased performance and potential shutdowns.

Maintenance Strategies:

1. Regular Cleaning and Inspection: Regular cleaning and inspection of the condenser tubes can help prevent tube failures and maintain heat transfer efficiency.
2. Tube Replacement: Replacing tubes that are damaged or showing signs of wear can prevent future failures.
3. Tube Sheet Replacement: Replacing the tube sheet can help prevent tube leaks or ruptures.
4. Condenser Coil Cleaning: Cleaning the condenser coils can help maintain heat transfer efficiency and prevent fouling.
5. Pump Maintenance: Regular maintenance of the cooling water pump, including inspection and replacement of worn parts, can help prevent pump failure.
6. Monitoring and Tr",1,water-cooledcondenser
91,Can you provide more information about the materials used in the construction of the Water-Cooled Condenser? How do these materials affect the asset's performance and lifespan?,"  Certainly! A Water-Cooled Condenser (WCC) is a type of heat exchanger that is commonly used in power plants, chemical plants, and other industrial facilities to transfer heat from a hot fluid to a cooling water stream. The materials used in the construction of a WCC can have a significant impact on its performance, reliability, and lifespan.

Here are some of the common materials used in the construction of a WCC:

1. Tubing: The tubing is the primary component of a WCC where the heat transfer takes place. The tubing is typically made of copper, aluminum, or stainless steel. Copper is a popular choice due to its high thermal conductivity, corrosion resistance, and low cost. Aluminum is also widely used due to its lightweight, corrosion resistance, and lower cost compared to copper. Stainless steel is used in applications where high strength, corrosion resistance, and durability are required.
2. Shell: The shell is the outer casing of the WCC that houses the tubing. It is typically made of carbon steel, stainless steel, or aluminum. The shell provides structural support and protection to the tubing and other internal components.
3. Heat transfer fins: Heat transfer fins are used to enhance the heat transfer rate between the hot fluid and the cooling water. The fins are typically made of aluminum, copper, or stainless steel and are attached to the outside of the tubing.
4. End caps: End caps are used to seal the ends of the WCC and provide structural support. They are typically made of carbon steel, stainless steel, or aluminum.
5. Gaskets and seals: Gaskets and seals are used to prevent leakage between the tubing and the shell, and to ensure a tight seal between the end caps and the shell. They are typically made of rubber, silicone, or other synthetic materials.
6. Supports and braces: Supports and braces are used to provide structural support to the WCC and to prevent it from collapsing under pressure. They are typically made of carbon steel, stainless steel, or aluminum.

The choice of",1,water-cooledcondenser
69,"How do changes in operating conditions, such as increased temperature or flow rate, affect the frequency or type of maintenance and inspection procedures required for the Water-Cooled Condenser?","  Changes in operating conditions, such as increased temperature or flow rate, can significantly impact the frequency or type of maintenance and inspection procedures required for a Water-Cooled Condenser. Here are some potential effects of operating condition changes on maintenance and inspection requirements:

1. Increased temperature:
	* Increased temperature can lead to increased corrosion rates, which can affect the integrity of the condenser tubes, headers, and other components. This may require more frequent inspections and maintenance to monitor corrosion rates and replace components before they fail.
	* Higher temperatures can also increase the risk of overheating, which can damage the condenser tubes and reduce their lifespan. This may require additional maintenance procedures, such as cleaning or replacing tubes, to prevent overheating.
2. Increased flow rate:
	* Increased flow rate can increase the risk of erosion and corrosion in the condenser tubes, which can reduce their lifespan and increase the risk of failure. This may require more frequent inspections and maintenance to monitor tube condition and replace them as needed.
	* Higher flow rates can also increase the risk of leaks and other damage to the condenser tubes and headers. This may require additional maintenance procedures, such as pressure testing and leak detection, to identify and repair any leaks or damage.
3. Changes in water quality:
	* Changes in water quality, such as increased levels of contaminants or minerals, can affect the corrosion rates and integrity of the condenser components. This may require more frequent inspections and maintenance to monitor water quality and adjust treatment chemicals or cleaning procedures as needed.
4. Increased cycling:
	* Increased cycling, or startup and shutdown cycles, can increase the risk of fatigue and wear on the condenser components, particularly the tubes and headers. This may require more frequent inspections and maintenance to monitor component condition and replace them as needed.
5. Changes in ambient conditions:
	* Changes in ambient conditions, such as increased humidity or temperature, can affect the condenser's performance and increase the risk of corrosion or other damage. This may require additional maintenance procedures, such as cleaning or coating the cond",1,water-cooledcondenser
97,"What are some common failure modes of the Water-Cooled Condenser system, and how do they occur? For example, what causes tube leaks, shell corrosion, and valve malfunction?","  As a reliability engineer expert in FMEA, I can provide you with information on common failure modes of the Water-Cooled Condenser system and their possible causes. Here are some examples:

1. Tube Leaks:

a. Causes:

i. Corrosion/erosion of tubes due to poor water quality or excessive flow rates.
ii. Tube wear and tear due to frequent start-ups and shutdowns.
iii. Damage from impingement or fretting due to improper tube support or design.

b. Failure Mode: Leakage of cooling water into the condenser, resulting in reduced heat transfer, increased pressure drop, and decreased efficiency.

c. Detection:

i. Visual inspection of tubes for signs of corrosion, wear, or damage.
ii. Pressure testing of tubes to identify leaks.
iii. Monitoring of cooling water flow rates and pressure drops to detect abnormalities.

d. Severity: High, as tube leaks can lead to reduced heat transfer, increased energy consumption, and potential environmental impact.

e. Ability to Detect Before Failure: Yes, through regular inspections and monitoring.

2. Shell Corrosion:

a. Causes:

i. Poor water quality or excessive water flow rates.
ii. Lack of proper shell protection or coating.
iii. Inadequate maintenance or cleaning.

b. Failure Mode: Corrosion of the condenser shell, leading to reduced heat transfer, increased pressure drop, and potential leakage.

c. Detection:

i. Visual inspection of the shell for signs of corrosion or wear.
ii. Ultrasonic thickness measurement to detect thinning of the shell.
iii. Monitoring of corrosion-related parameters, such as pH, conductivity, and dissolved oxygen levels.

d. Severity: High, as shell corrosion can lead to reduced heat transfer, increased energy consumption, and potential environmental impact.

e. Ability to Detect Before Failure: Yes, through regular inspections and monitoring.

3",1,water-cooledcondenser
88,Are there any specific design features or modifications that can be made to a Water-Cooled Condenser to reduce the risk of tube failures due to corrosion/erosion or fouling/scaling?,"  Yes, there are several design features and modifications that can be made to a Water-Cooled Condenser to reduce the risk of tube failures due to corrosion/erosion or fouling/scaling. Here are some possible design features and modifications:

1. Material selection: The selection of materials for the condenser tubes, tube sheets, and other components can play a crucial role in reducing the risk of corrosion/erosion and fouling/scaling. For example, using materials with high corrosion resistance, such as stainless steel or titanium, can help reduce the risk of corrosion/erosion.
2. Tube design: The design of the condenser tubes can also affect their performance and longevity. For example, using a tube design with a larger diameter and a longer length can help reduce the risk of fouling/scaling, as there is more space for the water to flow and less likelihood of debris accumulating.
3. Tube cleaning: Designing the condenser tubes with a cleaning mechanism, such as a rotating brush or a water jet, can help remove any debris or scaling that may accumulate and reduce the risk of fouling/scaling.
4. Water treatment: Implementing a water treatment system can help reduce the risk of corrosion/erosion and fouling/scaling. The water treatment system can remove impurities and minerals that can cause corrosion and scaling.
5. Condenser design: The design of the condenser can also affect its performance and longevity. For example, using a condenser with a horizontal or vertical tube design can help reduce the risk of fouling/scaling, as the water flows more evenly and there is less likelihood of debris accumulating.
6. Flow control: Implementing flow control measures, such as flow meters and flow control valves, can help regulate the water flow through the condenser and reduce the risk of fouling/scaling.
7. Monitoring and maintenance: Regular monitoring and maintenance of the condenser can help identify any potential issues before they become major problems. This can include monitoring the water quality, checking for leaks, and inspecting the condenser tubes for signs of corrosion/eros",1,water-cooledcondenser
83,Can you discuss the impact of condenser pressure on the WCC's performance and reliability? Are there any specific pressure ranges that are optimal for certain industries or applications?,"  Certainly! The condenser pressure plays a crucial role in the performance and reliability of a Water-Cooled Condenser (WCC). The condenser pressure is defined as the pressure at which the condenser operates, and it is typically measured in bars or pounds per square inch (psi).

The condenser pressure affects the WCC's performance and reliability in several ways:

1. Heat Transfer: The condenser pressure affects the heat transfer process between the condenser and the cooling water. Higher condenser pressures result in a higher heat transfer coefficient, which means that more heat can be transferred from the condenser to the cooling water. This can improve the WCC's performance and efficiency.
2. Flow Rate: The condenser pressure also affects the flow rate of the cooling water through the condenser. Higher pressures result in a higher flow rate, which can help to remove more heat from the condenser. However, if the flow rate is too high, it can lead to increased pressure drop and reduced heat transfer.
3. Leakage: Higher condenser pressures can lead to increased leakage rates, which can reduce the WCC's performance and reliability. Leakage can occur due to various reasons such as worn-out gaskets, damaged tubes, or improper installation.
4. Material Selection: The condenser pressure affects the selection of materials used in the construction of the WCC. For example, high-pressure condensers may require the use of more durable materials, such as stainless steel or titanium, to withstand the increased pressure and temperature.
5. Maintenance: Higher condenser pressures can make maintenance more challenging, as it may require specialized tools and techniques to inspect and repair the condenser.

Optimal pressure ranges for certain industries or applications depend on various factors such as the type of cooling water, ambient temperature, and the specific process requirements. However, some general guidelines for condenser pressure ranges are:

1. Power Generation: For power generation applications, the condenser pressure is typically in the range of 10-20 bar (145-290 psi).
2. Chemical Processing: In chemical processing, the condenser pressure can",1,water-cooledcondenser
8,"Can you provide more information about the cooling water system used in the Water-Cooled Condenser? What are the typical water flow rates, temperatures, and pressure levels?","  Certainly! A Water-Cooled Condenser is a common component in many industrial processes, and the cooling water system used in these condensers plays a critical role in their performance and reliability.

The cooling water system used in a Water-Cooled Condenser typically consists of a pump, a heat exchanger (the condenser), and a cooling tower. The pump circulates water through the heat exchanger, where it absorbs heat from the process fluid (such as steam or gas) and transfers it to the cooling tower. The cooling tower is designed to dissipate the heat to the atmosphere, causing the water to condense and return to the pump.

The typical water flow rates, temperatures, and pressure levels in a Water-Cooled Condenser will depend on the specific application and design of the system. However, here are some general ranges for each parameter:

Water flow rate:

* The water flow rate in a Water-Cooled Condenser can range from a few gallons per minute (GPM) to several hundred GPM. The exact flow rate will depend on the size of the condenser, the heat load, and the design of the system.

Water temperature:

* The temperature of the cooling water entering the condenser is typically in the range of 60°F to 120°F (15°C to 49°C).
* The temperature of the cooling water leaving the condenser is typically in the range of 120°F to 180°F (49°C to 82°C).

Pressure levels:

* The pressure level in a Water-Cooled Condenser can vary depending on the specific application. However, in general, the pressure level in the condenser is typically in the range of 10 to 150 psig (690 to 10,340 kPa).

It's worth noting that the specific design and operating conditions of the cooling water system can affect the reliability and performance of the Water-Cooled Condenser. Factors such as water quality, flow rates, and temperatures can all impact the system's efficiency and longevity.

In",0,water-cooledcondenser
37,"Can you provide more information on the degradation mechanisms that can occur in the Water-Cooled Condenser, such as corrosion, erosion, or fouling, and how do these mechanisms impact the system's performance and reliability?","  Certainly! A Water-Cooled Condenser is a critical component in many industrial processes, and it is susceptible to various degradation mechanisms that can impact its performance and reliability. Here are some of the most common degradation mechanisms that can occur in a Water-Cooled Condenser:

1. Corrosion: Corrosion is a major concern in Water-Cooled Condensers, especially in environments where the water used for cooling is corrosive or contaminated. Corrosion can occur on the tubes, headers, and other components of the condenser, leading to thinning of the walls, pitting, and eventually, failure. Corrosion can also lead to the formation of scales and deposits, which can further reduce the heat transfer efficiency of the condenser.
2. Erosion: Erosion can occur in the Water-Cooled Condenser due to the flow of water and other particles, such as sediment, through the tubes. This can lead to wear and tear on the tube walls, which can reduce the condenser's efficiency and lifespan.
3. Fouling: Fouling occurs when particles or substances accumulate on the surfaces of the condenser tubes, reducing the heat transfer efficiency. This can be caused by a variety of factors, including corrosion, erosion, and the presence of contaminants in the cooling water.
4. Scaling: Scaling occurs when minerals or other substances in the cooling water precipitate and form deposits on the surfaces of the condenser tubes. This can reduce the heat transfer efficiency and increase the pressure drop across the condenser, leading to reduced performance and reliability.
5. Microbiologically Induced Corrosion (MIC): MIC is a corrosion mechanism that occurs when microorganisms in the cooling water produce corrosive byproducts, such as hydrogen sulfide, that can corrode the condenser materials. This can lead to localized corrosion and pitting, which can reduce the condenser's lifespan.

These degradation mechanisms can impact the performance and reliability of the Water-Cooled Condenser in several ways:

1. Reduced heat transfer efficiency",1,water-cooledcondenser
52,Are there any emerging trends or technologies in industrial furnace maintenance that are expected to improve maintenance procedures or reduce maintenance costs in the future?,"  Yes, there are several emerging trends and technologies in industrial furnace maintenance that are expected to improve maintenance procedures and reduce maintenance costs in the future. Some of these trends and technologies include:

1. Predictive Maintenance: Predictive maintenance uses data and analytics to predict when maintenance will be required, allowing maintenance personnel to proactively schedule maintenance activities before a failure occurs. This approach can help reduce downtime and increase productivity.
2. Condition Monitoring: Condition monitoring technologies such as vibration analysis, thermal imaging, and acoustic emission can detect early warning signs of potential failures, allowing maintenance personnel to address issues before they become major problems.
3. Remote Monitoring: Remote monitoring technologies such as IoT (Internet of Things) enabled sensors and cameras can provide real-time monitoring of furnace performance and alert maintenance personnel to potential issues, allowing for quicker response times and reducing the need for on-site visits.
4. Augmented Reality: Augmented reality (AR) can be used to enhance maintenance procedures by providing technicians with real-time, interactive instructions and guidance. AR can also be used to train new technicians and improve their skills.
5. Artificial Intelligence (AI): AI can be used to analyze data from various sources such as sensors, maintenance records, and production data to predict potential failures and optimize maintenance schedules. AI can also be used to identify patterns and trends in furnace performance and provide recommendations for improvement.
6. Robotics and Automation: Robotics and automation can be used to perform routine maintenance tasks such as cleaning and inspection, reducing the need for manual labor and improving safety.
7. Energy Management Systems: Energy management systems can help optimize furnace performance and reduce energy consumption, reducing costs and environmental impact.
8. Refractory Lining Inspection: Advanced inspection techniques such as ultrasonic testing and laser profiling can detect cracks, erosion, and other damage in the refractory lining, allowing for early repair or replacement, reducing downtime and improving furnace performance.
9. Furnace Health Management: Furnace health management systems can provide real-time monitoring of furnace performance, alerting maintenance personnel",1,industrialfurnace
119,"How does the cooling system's performance impact the quality of the final product, and what are the potential consequences of a failure?","  The cooling system of an industrial furnace plays a crucial role in the quality of the final product. The cooling system is responsible for removing heat from the furnace and preventing overheating, which can cause a range of problems, including:

1. Product defects: Overheating can cause the product to become overcooked, leading to defects such as cracking, warping, or brittleness. This can result in a lower quality final product, which can lead to customer dissatisfaction and potential rejection.
2. Reduced productivity: Overheating can also cause the furnace to work less efficiently, leading to reduced productivity and increased production costs. This can result in increased energy consumption, longer production times, and higher maintenance costs.
3. Equipment damage: Overheating can damage the furnace and its components, leading to costly repairs and downtime. This can result in lost production time, increased maintenance costs, and potential safety hazards.
4. Safety risks: Overheating can also pose safety risks to operators and maintenance personnel. For example, it can lead to hot surfaces, steam explosions, or the release of toxic gases.

The potential consequences of a failure in the cooling system can be severe, including:

1. Product recalls: If the final product is defective due to overheating, it may be necessary to recall the product, leading to significant costs and damage to the company's reputation.
2. Production downtime: A failure in the cooling system can lead to furnace downtime, resulting in lost production time and revenue.
3. Equipment damage: A failure in the cooling system can cause damage to the furnace and its components, leading to costly repairs and replacement.
4. Safety risks: A failure in the cooling system can pose safety risks to operators and maintenance personnel, potentially leading to injuries or fatalities.

To prevent these consequences, it is essential to have a reliable cooling system and to perform regular preventive maintenance. This includes monitoring the cooling system's performance, identifying potential failure modes and their impact on the final product, and taking corrective actions before a failure occurs.

Some potential failure modes and their impact on the final product include:",1,industrialfurnace
175,How do you ensure that the sensors are properly shielded from electromagnetic interference?,"  As a reliability engineer, I would ensure that the sensors used in industrial furnaces are properly shielded from electromagnetic interference (EMI) by implementing the following measures:

1. Proper Sensor Selection: Select sensors that are designed to be resistant to EMI and have a high level of immunity to electromagnetic disturbances. Look for sensors that have been tested and certified to relevant standards such as IEC 61000-2-2 or ANSI C63.1.
2. Shielding: Ensure that the sensors are properly shielded using shielding materials such as metal or conductive plastic. The shielding material should be placed around the sensor and connected to a ground plane to dissipate any incoming electromagnetic energy.
3. Grounding: Proper grounding of the sensors and associated equipment is crucial to reduce EMI. Ensure that all metal components are properly grounded and that there are no broken or loose connections in the grounding system.
4. Cable Shielding: Use shielded cables to connect the sensors to the control system or data acquisition system. Ensure that the shield is properly connected to the ground plane at both ends of the cable.
5. Filtering: Use EMI filters to remove any electromagnetic noise from the sensor signals before they are transmitted to the control system or data acquisition system.
6. Proper Installation: Ensure that the sensors are installed in a location that minimizes their exposure to electromagnetic interference. Avoid installing sensors near sources of high electromagnetic radiation such as motors, generators, or transformers.
7. Regular Maintenance: Regularly inspect and maintain the sensors and associated equipment to ensure that they are functioning properly and that there are no signs of wear or damage that could compromise their performance.

By implementing these measures, I can ensure that the sensors used in industrial furnaces are properly shielded from electromagnetic interference, which will improve their reliability and accuracy, and reduce the likelihood of failures due to EMI.",1,industrialfurnace
