id,questions,answers,round,asset
77,Are there any constraints on the computational resources or time required to build and deploy the anomaly model? Are there any specific deadlines or timelines that must be met?,"  Background Document:

Subject: Anomaly Detection Model for Hydroelectric Power Turbine

Introduction:
The purpose of this document is to provide a comprehensive overview of the anomaly detection model development process for hydroelectric power turbines using real-time time series sensor data obtained from IoT/OT systems. This document will outline the important components, failure modes, and computational resources required to build and deploy the model.

Important Components:

1. Sensor Data: The anomaly detection model will be built using real-time time series sensor data obtained from IoT/OT systems. The sensors are installed on the hydroelectric power turbine and provide data on various parameters such as temperature, pressure, flow rate, and vibration.
2. Data Acquisition System: The data acquisition system is responsible for collecting data from the sensors and transmitting it to the data processing system. The system should be able to handle large volumes of data and ensure data quality and integrity.
3. Data Processing System: The data processing system is responsible for cleaning, preprocessing, and normalizing the data before it is fed into the anomaly detection model. The system should have the ability to handle real-time data processing and be able to handle large volumes of data.
4. Anomaly Detection Model: The anomaly detection model will be built using machine learning algorithms and techniques. The model should be able to detect anomalies in real-time and provide accurate predictions.
5. Alert System: The alert system is responsible for sending notifications to the operators and maintenance personnel when an anomaly is detected. The system should be able to send notifications via email, SMS, or other communication channels.

Important Failure Modes:

1. Equipment Failure: The hydroelectric power turbine is subject to various equipment failures such as bearing failure, shaft failure, and electrical component failure. These failures can lead to significant downtime and loss of production.
2. Sensor Failure: The sensors installed on the hydroelectric power turbine can fail due to various reasons such as sensor malfunction, data transmission failure, or software issues. Sensor failure can lead to inaccurate data and false alarms.
3. Data Acquisition Failure: The data ac",1,hydroelectricpowerturbine
156,Can you provide examples of specific anomalies or patterns in the sensor data that may indicate a potential failure?,"  Sure, I can provide some examples of specific anomalies or patterns in the sensor data that may indicate a potential failure in a hydroelectric power turbine.

1. Vibration anomalies: Abnormal vibration in the turbine blades, shaft, or bearings can indicate a potential failure. Sensor data can be used to detect changes in vibration patterns, such as increased amplitude or frequency, that may indicate a problem.
2. Temperature anomalies: Changes in temperature can indicate overheating or cooling issues, which can lead to turbine failure. Sensor data can be used to detect temperature changes in the turbine components, such as the bearing temperature, oil temperature, or water temperature.
3. Pressure anomalies: Changes in pressure can indicate issues with the turbine's inlet or outlet valves, or problems with the generator's pressure regulation. Sensor data can be used to detect changes in pressure patterns, such as sudden drops or spikes, that may indicate a problem.
4. Flow rate anomalies: Changes in flow rate can indicate issues with the turbine's inlet or outlet valves, or problems with the pump's performance. Sensor data can be used to detect changes in flow rate patterns, such as sudden changes or fluctuations, that may indicate a problem.
5. Noise anomalies: Abnormal noise in the turbine can indicate a potential failure. Sensor data can be used to detect changes in noise patterns, such as increased noise levels or unusual sound patterns, that may indicate a problem.
6. Oil leak anomalies: Oil leaks can indicate a potential failure in the turbine's bearings or seals. Sensor data can be used to detect changes in oil leak patterns, such as increased oil leakage or unusual oil leak patterns, that may indicate a problem.
7. Generator anomalies: Changes in the generator's performance can indicate a potential failure. Sensor data can be used to detect changes in generator patterns, such as changes in voltage, current, or power output, that may indicate a problem.
8. Cooling system anomalies: Changes in the cooling system's performance can indicate a potential failure. Sensor data can be used to detect changes in",1,hydroelectricpowerturbine
92,"What are the maintenance schedules and procedures for each of the critical components, and how do they impact the overall performance and reliability of the system?","  Background Document: Maintenance Schedules and Procedures for Hydroelectric Power Turbine Critical Components

Introduction:
Hydroelectric power turbines are critical assets in the renewable energy sector, and their proper maintenance is essential to ensure optimal performance, reliability, and longevity. This document provides an overview of the maintenance schedules and procedures for the critical components of a hydroelectric power turbine, highlighting their impact on the overall system performance and reliability.

1. Turbine Blades:
The turbine blades are responsible for converting the kinetic energy of the water into rotational energy. The blades are subject to wear and tear due to the continuous exposure to water and sediment. To maintain the blades' efficiency, the following maintenance procedures are typically performed:
* Visual inspection: Regular visual inspections are carried out to detect any damage, erosion, or sediment buildup on the blades.
* Cleaning: The blades are cleaned periodically to remove any sediment or debris that may have accumulated.
* Repair and replacement: Damaged blades are repaired or replaced to ensure optimal performance.
* Balancing: The blades are balanced to ensure that they rotate smoothly and evenly, reducing vibrations and stress on the turbine components.
2. Turbine Shaft:
The turbine shaft is responsible for transmitting the rotational energy from the turbine blades to the generator. The shaft is subject to wear and tear due to friction and vibrations. To maintain the shaft's integrity, the following maintenance procedures are typically performed:
* Lubrication: The shaft bearings are lubricated regularly to reduce friction and prevent wear.
* Inspection: Regular inspections are carried out to detect any signs of wear, misalignment, or vibration.
* Repair and replacement: Damaged or worn-out shaft components are repaired or replaced to ensure smooth operation.
3. Generator:
The generator converts the mechanical energy from the turbine into electrical energy. The generator is subject to wear and tear due to heat, vibrations, and electrical stress. To maintain the generator's performance, the following maintenance",1,hydroelectricpowerturbine
60,"Can you provide examples of successful anomaly detection and predictive maintenance efforts in hydroelectric power turbines, and what were the key factors that contributed to their success?","  Sure, I'd be happy to provide some examples of successful anomaly detection and predictive maintenance efforts in hydroelectric power turbines, as well as the key factors that contributed to their success.

1. Predictive Maintenance using Vibration Analysis:
One example of a successful predictive maintenance effort in hydroelectric power turbines is the use of vibration analysis to detect anomalies in the turbine's operation. Vibration sensors were installed on the turbine to measure the vibration of the machine and detect any abnormalities. The data collected from the sensors was then analyzed using machine learning algorithms to identify patterns and trends that could indicate a potential failure.

Key factors that contributed to the success of this effort include:

* The use of high-quality vibration sensors that were able to detect subtle changes in the turbine's operation.
* The implementation of machine learning algorithms that were able to identify complex patterns in the data.
* The integration of the vibration analysis system with the turbine's control system, which allowed for real-time monitoring and alerts.
2. Anomaly Detection using Thermal Imaging:
Another example of successful anomaly detection in hydroelectric power turbines is the use of thermal imaging to detect overheating in the turbine's bearings. Thermal imaging cameras were installed to monitor the temperature of the bearings and detect any abnormal heat signatures. The data collected from the cameras was then analyzed using machine learning algorithms to identify any patterns or trends that could indicate a potential failure.

Key factors that contributed to the success of this effort include:

* The use of high-resolution thermal imaging cameras that were able to detect subtle changes in temperature.
* The implementation of machine learning algorithms that were able to identify complex patterns in the data.
* The integration of the thermal imaging system with the turbine's control system, which allowed for real-time monitoring and alerts.
3. Predictive Maintenance using Oil Analysis:
Another successful predictive maintenance effort in hydroelectric power turbines is the use of oil analysis to detect anomalies in the turbine's lubrication system. Oil samples were collected from the turbine",1,hydroelectricpowerturbine
150,"Can you provide examples of how high humidity can cause errors in sensor readings, and how can these errors be mitigated?","  Background Document: Hydroelectric Power Turbine Anomaly Detection using Real-time Sensor Data

Introduction:
Hydroelectric power turbines are critical assets in renewable energy production. To ensure their optimal performance, it is essential to detect anomalies in real-time using sensor data. One of the challenges in this context is the impact of high humidity on sensor readings. This document provides examples of how high humidity can cause errors in sensor readings and how these errors can be mitigated.

Impact of High Humidity on Sensor Readings:

1. Sensor Calibration: High humidity can affect the calibration of sensors, leading to inaccurate readings. For instance, humidity can cause thermal expansion in metallic components, which can alter the sensitivity of temperature sensors. Similarly, humidity can affect the capacitance of capacitive sensors, leading to errors in pressure and vibration measurements.
2. Electrical Interference: High humidity can introduce electrical interference in sensor signals, causing noise and errors in readings. This is particularly true for sensors that use electrical signals to measure parameters such as temperature, pressure, and vibration.
3. Condensation: High humidity can lead to condensation on sensor lenses, windows, or other components, causing errors in optical measurements. Condensation can also create a wet environment that can damage sensors, leading to erroneous readings.
4. Corrosion: High humidity can accelerate corrosion in metallic components, which can affect sensor performance and accuracy. Corrosion can also lead to mechanical failures that can cause sensor malfunctions.

Mitigation Strategies:

1. Sensor Selection: Choose sensors that are designed to operate accurately in high-humidity environments. For example, use sensors with hermetically sealed enclosures or coatings that prevent moisture from affecting the sensing elements.
2. Calibration and Validation: Regularly calibrate and validate sensors to ensure their accuracy, especially in high-humidity environments. Use reference sensors or standards to verify the accuracy of the sensors.
3. Signal Conditioning",1,hydroelectricpowerturbine
113,"What are some common sources of vibration that can affect sensor accuracy in hydroelectric power turbines, and how can they be reduced or eliminated?","  Background Document: Hydroelectric Power Turbine Sensor Accuracy and Vibration Sources

Introduction:
Hydroelectric power turbines are critical assets in the renewable energy sector, and their efficient operation is crucial for power generation. Sensor accuracy is vital for monitoring and controlling the turbine's performance, but vibration can significantly affect sensor accuracy. This document identifies common sources of vibration in hydroelectric power turbines and discusses ways to reduce or eliminate them.

1. Vibration Sources:

a. Mechanical Vibrations:

i. Turbine blade vibration: Caused by the rotation of the turbine blades, this vibration can affect the accuracy of sensors measuring blade position, angle, and vibration.

ii. Shaft vibration: Vibration in the shaft can affect the accuracy of sensors measuring shaft position, speed, and vibration.

iii. Bearing vibration: Vibration in the bearings can affect the accuracy of sensors measuring bearing temperature, vibration, and lubrication.

b. Electromagnetic Interference (EMI):

i. Electrical cabinets: EMI from electrical cabinets can affect the accuracy of sensors measuring electrical parameters such as voltage, current, and power.

ii. Motor drives: EMI from motor drives can affect the accuracy of sensors measuring motor speed, torque, and current.

iii. Other electrical equipment: EMI from other electrical equipment in the surrounding area can also affect sensor accuracy.

c. Acoustic Noise:

i. Turbine noise: Noise generated by the turbine can affect the accuracy of acoustic sensors measuring turbine sound levels.

ii. Environmental noise: Noise from the surrounding environment, such as water flow, wind, and animal sounds, can also affect sensor accuracy.

1. Reducing or Eliminating Vibration Sources:

a. Mechanical Vibrations:

i. Balancing: Balancing the turbine blades and shaft can reduce mechanical vibrations.

ii. Damping: Damping materials can be applied to reduce vibrations in the turbine blades, shaft",1,hydroelectricpowerturbine
99,"What are the main challenges in interpreting the results of the machine learning algorithms, and how do you ensure that the predictions are accurate and reliable?","  Background Document: Anomaly Detection in Hydroelectric Power Turbines using Machine Learning

Introduction:
Hydroelectric power turbines are critical assets in the renewable energy sector, and their reliable operation is essential to ensure a stable power supply. With the increasing use of IoT/OT systems, machine learning algorithms have become more prevalent in detecting anomalies and predicting failures in these turbines. However, interpreting the results of these algorithms and ensuring their accuracy and reliability can be challenging. This document outlines the main challenges and proposes strategies to address them.

Challenges in Interpreting Machine Learning Results:

1. Data Quality: Machine learning algorithms rely heavily on high-quality data to learn patterns and make accurate predictions. However, sensor data from hydroelectric power turbines can be noisy, incomplete, or inconsistent, which can affect the accuracy of the model.
2. Feature Engineering: Identifying the right features that represent the critical components of the turbine and their failure modes is crucial for building an effective anomaly model. However, this requires a deep understanding of the domain, and feature engineering can be a time-consuming and challenging task.
3. Model Interpretability: Machine learning models can be complex and difficult to interpret, making it challenging to understand the reasoning behind their predictions. This lack of transparency can make it difficult to identify and address errors in the model.
4. Overfitting and Underfitting: Overfitting occurs when the model is too complex and learns the noise in the training data, resulting in poor generalization to new data. Underfitting occurs when the model is too simple and fails to capture the underlying patterns, resulting in poor accuracy. Finding the right balance between model complexity and accuracy is crucial.
5. Sensor Data Limitations: Sensor data from hydroelectric power turbines can have limitations, such as measurement noise, sensor drift, or incomplete data. These limitations can affect the accuracy of the model and the reliability of the predictions.

Strategies to Address Challenges:

1. Data Preprocessing: Apply data preprocessing techniques, such as filtering, normalization, and feature scaling, to ensure that the data is clean, consistent, and representative of the tur",1,hydroelectricpowerturbine
61,"How do hydroelectric power turbine operators currently monitor and analyze sensor data to predict and prevent failures, and what are the biggest challenges and limitations in this process?","  Background Document: Hydroelectric Power Turbine Monitoring and Analysis

Introduction:
Hydroelectric power turbines are critical assets in the renewable energy sector, and their reliable operation is essential to ensure a stable power supply. To predict and prevent failures, hydroelectric power turbine operators rely on monitoring and analyzing sensor data. This document provides an overview of the current methods used by operators, the challenges they face, and the limitations of these approaches.

Current Methods:
Hydroelectric power turbine operators use a combination of manual and automated methods to monitor and analyze sensor data. The primary methods include:

1. Visual Inspection: Operators perform regular visual inspections of the turbine and its components to identify any abnormalities or signs of wear and tear.
2. Sensor Data Monitoring: A range of sensors are installed on the turbine to monitor various parameters such as temperature, pressure, flow rate, and vibration. Operators monitor this data in real-time to detect any anomalies or deviations from normal operating conditions.
3. Data Logging: Sensor data is logged and stored for future analysis. This data is used to identify patterns and trends that may indicate potential failures.
4. Predictive Maintenance: Some operators use predictive maintenance techniques, such as vibration analysis, oil analysis, and thermography, to identify potential failures before they occur.

Challenges and Limitations:
Despite the current methods used by hydroelectric power turbine operators, there are several challenges and limitations that hinder their ability to effectively monitor and analyze sensor data. These include:

1. Data Quality: Sensor data can be affected by various factors such as noise, calibration issues, and data transmission errors, which can compromise data quality.
2. Data Overload: The sheer volume of sensor data generated by hydroelectric power turbines can be overwhelming, making it difficult for operators to analyze and identify meaningful patterns.
3. Lack of Standardization: There is currently no standardized approach to monitoring and analyzing sensor data in the hydroelectric power turbine industry, which can make it difficult to compare data across different turbines and plants.
4. Limited Visibility: Sensor data",1,hydroelectricpowerturbine
29,"How does the hydroelectric power turbine system integrate with other renewable energy sources, such as wind or solar power? Are there any specific challenges or considerations when combining different types of renewable energy sources?","  Background Document: Hydroelectric Power Turbine System Integration with Renewable Energy Sources

Introduction:
Hydroelectric power turbines are a reliable and efficient source of renewable energy, and they can be effectively integrated with other renewable energy sources, such as wind or solar power, to create a hybrid renewable energy system. In this document, we will discuss the integration of hydroelectric power turbines with other renewable energy sources, the challenges and considerations involved, and the benefits of such a system.

Integration of Hydroelectric Power Turbines with Other Renewable Energy Sources:
Hydroelectric power turbines can be integrated with other renewable energy sources in several ways:

1. Wind-Hydroelectric Hybrid System: In this system, wind turbines generate electricity during periods of high wind, and the excess energy is used to pump water from a lower reservoir to an upper reservoir. During periods of low wind, the water from the upper reservoir is released through a hydroelectric turbine to generate electricity.
2. Solar-Hydroelectric Hybrid System: In this system, solar panels generate electricity during the day, and the excess energy is used to pump water from a lower reservoir to an upper reservoir. During periods of low solar radiation, the water from the upper reservoir is released through a hydroelectric turbine to generate electricity.
3. Hydroelectric-Wind-Solar Hybrid System: In this system, hydroelectric power turbines, wind turbines, and solar panels are combined to create a hybrid renewable energy system. The system uses a combination of hydroelectric, wind, and solar power to generate electricity, depending on the availability of each source.

Challenges and Considerations:
Integrating hydroelectric power turbines with other renewable energy sources poses several challenges and considerations:

1. Balancing Energy Supply and Demand: The integration of hydroelectric power turbines with other renewable energy sources requires careful balancing of energy supply and demand. The system must be able to adjust to changes in energy demand and availability of renewable energy sources.
2. Energy Storage:",1,hydroelectricpowerturbine
21,"How do environmental factors, such as water quality, temperature, and flow rate, affect the performance and reliability of the hydroelectric power turbine system? Are there any specific environmental conditions that can lead to increased risk of failure?","  Background Document: Environmental Factors and Their Impact on Hydroelectric Power Turbine Performance and Reliability

Introduction:
Hydroelectric power turbines are a vital component in the renewable energy sector, and their performance and reliability are critical to ensuring a stable power supply. Environmental factors, such as water quality, temperature, and flow rate, play a significant role in affecting the performance and reliability of hydroelectric power turbines. This document will explore the impact of these environmental factors on hydroelectric power turbines and identify specific conditions that can lead to increased risk of failure.

Water Quality:
Water quality is a crucial factor in hydroelectric power turbine performance. Sediment, dissolved gases, and other contaminants in the water can affect the turbine's efficiency and reliability. Sediment can accumulate on the turbine blades, reducing their efficiency and increasing the risk of damage. Dissolved gases, such as oxygen and nitrogen, can cause cavitation, which can lead to erosion and damage to the turbine components.

Water Temperature:
Water temperature also plays a significant role in hydroelectric power turbine performance. Changes in water temperature can affect the turbine's efficiency and power output. Warmer water can reduce the turbine's efficiency, while colder water can increase its power output. However, extreme temperature fluctuations can lead to thermal stress, which can cause damage to the turbine components.

Water Flow Rate:
Water flow rate is another critical environmental factor that affects hydroelectric power turbine performance. Changes in water flow rate can affect the turbine's power output and efficiency. Increased water flow rate can lead to increased power output, while decreased water flow rate can result in reduced power output. However, sudden changes in water flow rate can cause stress on the turbine components, leading to increased risk of failure.

Specific Environmental Conditions Leading to Increased Risk of Failure:

1. Low Water Flow Rate: Prolonged periods of low water flow rate can lead to increased risk of failure due to reduced lubrication and cooling of the turbine components.
2. High Water Temperature: S",1,hydroelectricpowerturbine
